{
  "$schema": "https://axa-oss.github.io/cienergy/schema/v1.json",
  "specVersion": "1.0.0",
  "sciSpecVersion": "ISO/IEC 21031:2024",
  "run": {
    "id": "local-1780614978",
    "platform": "local",
    "repository": "myorg/myapp",
    "workflow": "ci.yml",
    "commitSha": "0000000",
    "startedAt": "2026-06-04T23:16:17Z",
    "endedAt": "2026-06-04T23:16:18.210536Z",
    "durationSeconds": 1.210536
  },
  "runner": {
    "os": "linux",
    "arch": "x86_64",
    "vcpu": 4,
    "ramGiB": 16,
    "cpuModel": "Intel Xeon Platinum 8370C",
    "tdpWatts": 270,
    "provider": "local",
    "region": "US-VA"
  },
  "energy": {
    "totalKWh": 0.020966,
    "byStep": [
      {
        "name": "checkout",
        "kWh": 0.000034,
        "durationSeconds": 3,
        "source": "eco-ci-model",
        "cpuUtilPct": 15
      },
      {
        "name": "setup-jdk",
        "kWh": 0.000315,
        "durationSeconds": 12,
        "source": "eco-ci-model",
        "cpuUtilPct": 35
      },
      {
        "name": "build",
        "kWh": 0.012285,
        "durationSeconds": 210,
        "source": "eco-ci-model",
        "cpuUtilPct": 78
      },
      {
        "name": "test",
        "kWh": 0.007673,
        "durationSeconds": 165,
        "source": "eco-ci-model",
        "cpuUtilPct": 62
      },
      {
        "name": "docker-build",
        "kWh": 0.00066,
        "durationSeconds": 16,
        "source": "eco-ci-model",
        "cpuUtilPct": 55
      }
    ]
  },
  "carbon": {
    "operationalGCO2eq": 8.198,
    "embodiedGCO2eq": 0.001,
    "totalGCO2eq": 8.199,
    "gridIntensity": {
      "valueGCO2eqPerKWh": 391,
      "source": "ember-monthly",
      "zone": "US-VA",
      "timestamp": "2026-06-04T23:00:00Z"
    },
    "embodiedSource": "boavizta"
  },
  "sci": {
    "value": 8.199,
    "unit": "gCO2eq",
    "functionalUnit": "1 pipeline run",
    "R": 1
  }
}